{
  "_comment": "Reviewed baseline for the continuous Gauntlet lane. Exact candidate scores become the next run's floors and ceiling only through a promotion PR. Public records remain append-only and the latest-verified pointer moves only with that reviewed commit.",
  "corpus_git_sha": "b9baf394b5cb303139bf7da56608e97dad9009db",
  "corpus_sha256": "5556501847dfebf7e160366780950ac9aec1f4d602fdc7e57cab29aac606a26c",
  "corpus_version": "v2.3.0",
  "observed_case_count": {
    "applicable": 213,
    "not_applicable": 1,
    "not_applicable_reasons": {
      "missing_requires": 1
    },
    "total": 214
  },
  "pipelock_version": "3.3.0",
  "recorded_on": "2026-08-05",
  "runner_version": "0.4.2",
  "schema_version": 1,
  "score_ceilings": {
    "applicable": {
      "false_positive_rate": 0
    }
  },
  "score_floors": {
    "applicable": {
      "containment": 0.9936708860759493,
      "detection": 1,
      "evidence": 1
    },
    "full": {
      "containment": 0.9874213836477987
    }
  },
  "scoring_version": "2.4",
  "verified_artifact_id": "github-actions:luckyPipewrench/agent-egress-bench:30962417325",
  "verified_candidate_sha256": "4634014ed71559ee542113e7073be6961eca18710b67f8b792c13afd6f595afd"
}
